,codingWeek,channelId,videoId,title,publishedAt,viewCount,likeCount,dislikeCount,commentCount,duration,channelTitle,subscriberCount,country,videoURL
0,2020-01-05-2020-01-12,UC4SUWizzKc1tptprBkWjX2Q,5KJUcKV9q50,China identifies new coronavirus behind Wuhan pneumonia outbreak,2020-01-09T08:20:52Z,679398,2615,302,811,67,South China Morning Post,2630000,HK,https://www.youtube.com/watch?v=5KJUcKV9q50
1,2020-01-05-2020-01-12,UC83jt4dlz1Gjl58fzQrrKZg,VbrXBTJUESw,China says pneumonia outbreak due to new type of coronavirus,2020-01-09T12:36:27Z,84737,455,26,310,150,CNA,1620000,SG,https://www.youtube.com/watch?v=VbrXBTJUESw
2,2020-01-05-2020-01-12,UChirEOpgFCupRAk5etXqPaA,yHZU58UbUVA,How China's Mystery Pneumonia Illness is Different From SARS,2020-01-10T09:21:15Z,64157,386,67,280,69,Bloomberg Quicktake: Now,1040000,US,https://www.youtube.com/watch?v=yHZU58UbUVA
3,2020-01-05-2020-01-12,UC83jt4dlz1Gjl58fzQrrKZg,jggndUgvhrk,Pneumonia cases in China&#39;s Wuhan could be due to new type of virus: WHO,2020-01-09T07:34:48Z,44832,357,17,265,336,CNA,1620000,SG,https://www.youtube.com/watch?v=jggndUgvhrk
4,2020-01-05-2020-01-12,UCwd8fNhb8OPLPSNELSys9pg,VCgjoCdnT7o,SARS officers pressed my yansh while arresting me - pregnant woman laments,2020-01-09T09:46:39Z,31667,99,15,23,211,Legit TV,196000,NG,https://www.youtube.com/watch?v=VCgjoCdnT7o
5,2020-01-05-2020-01-12,UC262-NFJtcZMJh1CHn2H3wA,LC00nbAmVVs,Wuhan SARS? Chinese officials race to identify mysterious pneumonia strain,2020-01-07T07:27:43Z,3147,N/A,N/A,N/A,191,Kristie Lu Stout,,HK,https://www.youtube.com/watch?v=LC00nbAmVVs
