,codingWeek,channelId,videoId,title,publishedAt,viewCount,likeCount,dislikeCount,commentCount,duration,channelTitle,subscriberCount,country,videoURL
0,2020-09-13-2020-09-20,UCVTyTA7-g9nopHeHbeuvpRA,rZEFY9Ke-dk,"Trump Blames ""Blue States"" For COVID Deaths: A Closer Look",2020-09-18T01:00:11Z,5653387,49857,2352,8576,956,Late Night with Seth Meyers,4240000,US,https://www.youtube.com/watch?v=rZEFY9Ke-dk
1,2020-09-13-2020-09-20,UCJ0uqCI0Vqr2Rrt1HseGirg,fN6uzhy5uvU,DUA LIPA Has &#39;New Rules&#39; For COVID Dating,2020-09-18T06:08:41Z,4798628,217618,2723,4271,203,The Late Late Show with James Corden,27100000,Unknown,https://www.youtube.com/watch?v=fN6uzhy5uvU
2,2020-09-13-2020-09-20,UC0rE2qq81of4fojo-KhO5rg,JwFzULgF2AE,WE TOOK COVID ANTIBODY TEST - VLOG 45,2020-09-13T14:30:09Z,1941823,189316,1906,5174,500,Tanmay Bhat,3610000,IN,https://www.youtube.com/watch?v=JwFzULgF2AE
3,2020-09-13-2020-09-20,UC_Lnb8ZHqqgLbp-7hltuT9w,MQ5aYS4YFlQ,COVID-19 In Philippines: The Starving Urban Poor. What Went Wrong? | Insight | Poverty In Asia,2020-09-16T12:00:03Z,1123789,10831,928,6544,2994,CNA Insider,991000,SG,https://www.youtube.com/watch?v=MQ5aYS4YFlQ
4,2020-09-13-2020-09-20,UC8oimTPVHKiC7oL3QgdKbgg,azftg6ikvMc,"Kardashians Tackle Pregnancy, COVID &amp; More This Season | KUWTK | E!",2020-09-15T16:04:28Z,1025035,14134,278,654,66,Keeping Up With The Kardashians,1760000,US,https://www.youtube.com/watch?v=azftg6ikvMc
5,2020-09-13-2020-09-20,UCvJJ_dzjViJCoLf5uKUTwoA,FWWPJ9TaRbA,What Is An mRNA Coronavirus Vaccine?,2020-09-19T16:00:04Z,923850,7841,1768,4025,1023,CNBC,2540000,Unknown,https://www.youtube.com/watch?v=FWWPJ9TaRbA
6,2020-09-13-2020-09-20,UCupvZG-5ko_eiXAupbDfxWw,2Tfp_2u2oBc,Brianna Keilar calls out Fox News guest&#39;s Covid-19 misinformation,2020-09-17T22:52:55Z,611052,10077,1114,3737,362,CNN,13000000,Unknown,https://www.youtube.com/watch?v=2Tfp_2u2oBc
7,2020-09-13-2020-09-20,UCTzf99EUGj8b843DRb3CJIw,eohJZkzyEig,COVID 19 TESTS | RT-PCR Vs Rapid Antigen Test | konsaa kovidd ttestt krvaae | sbse acchaa kovidd ttestt,2020-09-13T15:41:44Z,603806,7927,571,317,354,GUJMOM TV,46200,IN,https://www.youtube.com/watch?v=eohJZkzyEig
8,2020-09-13-2020-09-20,UCrtd2wePvAl6RN_D-9jWVQQ,cy1kdZhXsP8,COVID-19 Management With Dr. Paul Marik - Author Of MATH+ Protocol,2020-09-16T02:09:57Z,598772,8014,304,988,3748,Drbeen Medical Lectures,476000,US,https://www.youtube.com/watch?v=cy1kdZhXsP8
9,2020-09-13-2020-09-20,UCweOkPb1wVVH0Q0Tlj4a5Pw,5zjWC2Kj5jQ,[MV] BUMKEY(beomki) _ COVID-19(yeogijeogigeogi) (Feat. SUPERBEE(supeobi)),2020-09-18T09:00:03Z,578703,19353,134,397,181,1theK (원더케이),23700000,Unknown,https://www.youtube.com/watch?v=5zjWC2Kj5jQ
10,2020-09-13-2020-09-20,UC_gUM8rL-Lrg6O3adPW9K1g,ESXi21BJrJU,Gravitas: Wuhan virus made in lab? Chinese virologist has &#39;proof&#39;,2020-09-14T18:56:09Z,559552,18233,479,2393,199,WION,4050000,IN,https://www.youtube.com/watch?v=ESXi21BJrJU
11,2020-09-13-2020-09-20,UCH5_L3ytGbBziX0CLuYdQ1Q,TGWNCl0Wdy4,How Unemployment Impacted Millennials During Coronavirus,2020-09-17T16:00:06Z,531810,7428,428,3378,721,CNBC Make It,850000,US,https://www.youtube.com/watch?v=TGWNCl0Wdy4
12,2020-09-13-2020-09-20,UCh_uOd8H4JwwAy5rYo2_aOA,S_1Z8cSXI-Q,COVID Diagnosis with PCR | Misinterpreting results | Cycle threshold explained,2020-09-19T09:16:12Z,518383,9103,334,2722,676,Anthony Kuster,21000,TH,https://www.youtube.com/watch?v=S_1Z8cSXI-Q
13,2020-09-13-2020-09-20,UCIALMKvObZNtJ6AmdCLP7Lg,ukVVkyf_xYE,"Bill Gates on Coronavirus Pandemic, Vaccines",2020-09-16T02:51:21Z,503617,3550,9329,7181,1118,Bloomberg Markets and Finance,1130000,Unknown,https://www.youtube.com/watch?v=ukVVkyf_xYE
14,2020-09-13-2020-09-20,UCgrNz-aDmcr2uuto8_DL2jg,yDYsrhxx9R4,The Frontline: China&#39;s fight against COVID-19 | Documentary series 2 of 2,2020-09-14T00:17:24Z,410170,8179,280,1834,2704,CGTN,2630000,CN,https://www.youtube.com/watch?v=yDYsrhxx9R4
15,2020-09-13-2020-09-20,UCmEzBOAFElfaHS1oQ11K3gg,ZvqjkbD-moA,Mouth rinse and gargle COVID-19 test for school-aged children,2020-09-18T04:10:46Z,362222,N/A,N/A,0,164,Provincial Health Services Authority (PHSA),,CA,https://www.youtube.com/watch?v=ZvqjkbD-moA
16,2020-09-13-2020-09-20,UCpi2S8wW4xLlUCVryhyBtsA,Cf46dXnIyo8,FACT CHECK: Is Daily Steam Inhalation Proven to Kill Coronavirus at 70degC &amp; Cure COVID-19?,2020-09-18T03:30:01Z,307730,1669,309,263,117,Factly,66200,IN,https://www.youtube.com/watch?v=Cf46dXnIyo8
17,2020-09-13-2020-09-20,UCZYTClx2T1of7BRZ86-8fow,-JcoFa5ieyA,COVID-19 Reinfections Are a Thing: Here's What We Know So Far | SciShow News,2020-09-18T21:00:00Z,295771,16719,263,1114,289,SciShow,6910000,US,https://www.youtube.com/watch?v=-JcoFa5ieyA
18,2020-09-13-2020-09-20,UC3prwMn9aU2z5Y158ZdGyyA,U023FSiOdf0,Chinese Virologist Claims Coronavirus Was Man-Made In Wuhan's Laboratory,2020-09-14T12:50:53Z,289304,3946,386,1443,237,CRUX,1030000,IN,https://www.youtube.com/watch?v=U023FSiOdf0
19,2020-09-13-2020-09-20,UCzyev_TJ-jgpqIBhsEn4QDg,FXRdV52dNqU,COVID-19 Symptoms PSA (Hindi),2020-09-16T13:37:53Z,247406,2623,107,N/A,72,mnhealth,22800,US,https://www.youtube.com/watch?v=FXRdV52dNqU
20,2020-09-13-2020-09-20,UCtwMWJr2BFPkuJTnSvCESSQ,8DlETXkvHZQ,&#39;Cartoons Eric &amp; Don Jr. Invent a COVID-19 Vaccine&#39; Ep. 311 Clip | Our Cartoon President | SHOWTIME,2020-09-17T14:00:02Z,201377,3671,76,186,81,SHOWTIME,859000,Unknown,https://www.youtube.com/watch?v=8DlETXkvHZQ
21,2020-09-13-2020-09-20,UCEu502vFxm_7G13bPrzPhlA,mm7hH18Fk9U,CORONAVIRUS: Diet Regulations | ETV Life,2020-09-14T07:10:18Z,197358,1810,138,59,286,ETV Life India,553000,IN,https://www.youtube.com/watch?v=mm7hH18Fk9U
22,2020-09-13-2020-09-20,UC_Lnb8ZHqqgLbp-7hltuT9w,RhDHGgo4yZg,Starving in Philippines&#39; Coronavirus Lockdown: A 16-Year-Old&#39;s Story,2020-09-18T23:00:04Z,164431,1741,85,820,419,CNA Insider,991000,SG,https://www.youtube.com/watch?v=RhDHGgo4yZg
23,2020-09-13-2020-09-20,UCENdrrK5sWM-RV5nTLwBNXw,5DkNBFshjB8,What Jimmy Kimmel Thinks of Adam Carolla&#39;s Tweets About COVID,2020-09-17T14:03:22Z,143371,1143,553,45,163,The Howard Stern Show,1450000,US,https://www.youtube.com/watch?v=5DkNBFshjB8
24,2020-09-13-2020-09-20,UCknLrEdhRCp1aegoMqRaCZg,UPS7c32PBc0,China declares victory over the coronavirus pandemic - rightly so? | COVID-19 Special,2020-09-17T07:04:31Z,114419,876,652,1473,686,DW News,2960000,DE,https://www.youtube.com/watch?v=UPS7c32PBc0
25,2020-09-13-2020-09-20,UCNye-wNBqNL5ZzHSJj3l8Bg,S5Yv9yX_iIo,China: COVID-19 vaccine will be available by November,2020-09-17T13:35:50Z,112505,734,201,623,147,Al Jazeera English,8360000,QA,https://www.youtube.com/watch?v=S5Yv9yX_iIo
26,2020-09-13-2020-09-20,UC6ZFN9Tx6xh-skXCuRHCDpQ,RyTKX30F6po,Venezuela&#39;s humanitarian crisis has only worsened under COVID-19,2020-09-18T00:11:01Z,107898,1069,70,N/A,540,PBS NewsHour,2840000,US,https://www.youtube.com/watch?v=RyTKX30F6po
27,2020-09-13-2020-09-20,UCzWQYUVCpZqtN93H8RR44Qw,2D-ie92xwuw,Nose Swabs vs. Saliva: Which COVID Test Should You Take?,2020-09-18T11:00:00Z,101713,2274,148,460,261,Seeker,4900000,US,https://www.youtube.com/watch?v=2D-ie92xwuw
28,2020-09-13-2020-09-20,UC16niRr50-MSBwiO3YDb3RA,aQHn2h-B594,"A cold, flu or coronavirus - which one do I have? - BBC News",2020-09-17T11:49:24Z,93811,923,377,535,112,BBC News,11100000,GB,https://www.youtube.com/watch?v=aQHn2h-B594
29,2020-09-13-2020-09-20,UCH1oRy1dINbMVp3UFWrKP0w,oaAo_5ogKsE,Are you experiencing signs of COVID-19? Here's what to do once you know them l GMA Digital,2020-09-17T08:00:13Z,88468,665,52,147,460,Good Morning America,3720000,US,https://www.youtube.com/watch?v=oaAo_5ogKsE
